{"exported":"2026-03-16T14:00:00.000Z","total":3,"rated":2,"selections":[{"file":"icon-a.html","name":"icon a","rating":"unrated","note":null,"components":[]},{"file":"icon-b.html","name":"icon b","rating":"yay","note":null,"components":[]},{"file":"icon-c.html","name":"icon c","rating":"nay","note":null,"components":[]}]}
