{"exported":"2026-04-08T12:00:00.000Z","total":4,"rated":2,"selections":[{"file":"fixture-page-1.html","name":"fixture page 1","rating":"yay","note":null,"components":[{"name":"HeroHeading","rating":"yay","note":null},{"name":"BodyCopy","rating":"yay","note":null}]},{"file":"fixture-page-2.html","name":"fixture page 2","rating":"nay","note":null,"components":[{"name":"HeroHeading","rating":"unrated","note":null}]},{"file":"fixture-page-3.html","name":"fixture page 3","rating":"unrated","note":null,"components":[]},{"file":"archive/fixture-archived.html","name":"fixture archived","rating":"unrated","note":null,"components":[]}]}
